{
 "$schema": "https://json-schema.org/draft/2020-12/schema",
 "$id": "https://koat-secretary/schema/config.schema.json",
 "title": "서무비서 기관 설정(secretary/config.json)",
 "type": "object",
 "required": [
  "org"
 ],
 "properties": {
  "schema_version": {
   "type": "integer"
  },
  "org": {
   "type": "object",
   "required": [
    "name"
   ],
   "properties": {
    "name": {
     "type": "string",
     "description": "기관 정식 명칭"
    },
    "short": {
     "type": "string",
     "description": "영문 약칭"
    },
    "abbr": {
     "type": "string",
     "description": "줄임말"
    }
   }
  },
  "service": {
   "type": "object",
   "properties": {
    "title": {
     "type": "string"
    },
    "icon": {
     "type": "string",
     "maxLength": 4
    },
    "primary": {
     "type": "string",
     "pattern": "^#[0-9a-fA-F]{6}$"
    },
    "tagline": {
     "type": "string"
    },
    "footer": {
     "type": "string"
    }
   }
  },
  "terms": {
   "type": "object",
   "description": "절차 문장 [[키]] 자리표시의 기관 명칭",
   "properties": {
    "erp": {
     "type": "string"
    },
    "portal": {
     "type": "string"
    },
    "accounting": {
     "type": "string"
    },
    "approval": {
     "type": "string"
    }
   }
  },
  "erp": {
   "type": "object",
   "description": "ERP·그룹웨어 — 확장 배포 주소와 화면 규칙. preset 은 secretary/erp_presets.json 의 바탕 묶음, 나머지는 그 위에 더하는 기관 맞춤 규칙",
   "properties": {
    "hosts": {"type": "array", "items": {"type": "string"}},
    "name": {"type": "string"},
    "preset": {"type": "string"},
    "submit_words": {"type": "array", "items": {"type": "string"}, "description": "이름 전체가 같을 때만 결재 전 점검을 띄우는 제출 버튼 이름"},
    "screen_rules": {"type": "array", "items": {"type": "object", "required": ["match", "proc"],
                     "properties": {"by": {"enum": ["url", "title"]}, "match": {"type": "string"}, "proc": {"type": "string"}, "q": {"type": "string"}}}},
    "skip_paths": {"type": "array", "items": {"type": "string"}},
    "labels": {"type": "object", "properties": {"start": {"type": "array", "items": {"type": "string"}},
               "end": {"type": "array", "items": {"type": "string"}}, "ignore": {"type": "array", "items": {"type": "string"}}}}
   }
  },
  "reg_aliases": {
   "type": "object",
   "description": "절차가 참조하는 규정명 → 우리 기관 규정명",
   "additionalProperties": {
    "type": "string"
   }
  },
  "holidays": {
   "type": "object",
   "properties": {
    "extra": {
     "type": "array",
     "items": {
      "type": "object",
      "required": [
       "date"
      ],
      "properties": {
       "date": {
        "type": "string",
        "pattern": "^\\d{4}-\\d{2}-\\d{2}$"
       },
       "name": {
        "type": "string"
       }
      }
     }
    },
    "exclude": {
     "type": "array",
     "items": {
      "type": "string",
      "pattern": "^\\d{4}-\\d{2}-\\d{2}$"
     }
    }
   }
  },
  "audit": {
   "type": "object",
   "description": "결재 전 사전 감사 기준(생략하면 기본값). 숙박비 상한·추가지급 비율·근거·초안 필수 항목",
   "properties": {
    "lodging_caps": {
     "type": "array",
     "items": {
      "type": "object",
      "required": [
       "name",
       "cap"
      ],
      "properties": {
       "name": {
        "type": "string"
       },
       "cap": {
        "type": "integer",
        "minimum": 0
       }
      }
     }
    },
    "lodging_extra_ratio": {
     "type": "number",
     "minimum": 0,
     "maximum": 1
    },
    "lodging_basis": {
     "type": "array",
     "items": {
      "type": "object"
     }
    },
    "card_basis": {
     "type": "object"
    },
    "trip_procs": {
     "type": "array",
     "items": {
      "type": "string"
     }
    },
    "draft_required": {
     "type": "object",
     "additionalProperties": {
      "type": "object",
      "properties": {
       "fields": {
        "type": "array",
        "items": {
         "type": "string"
        }
       },
       "basis": {
        "type": "object"
       }
      }
     }
    }
   }
  },
  "insights": {
   "type": "object",
   "description": "기관 집단 지식(익명 통계) 설정",
   "properties": {
    "enabled": {
     "type": "boolean"
    },
    "min_n": {
     "type": "integer",
     "minimum": 1
    }
   }
  },
  "budget": {
   "type": "object",
   "description": "예산과목 기준표(기관 자체예산집행지침) — 절차별 흔한 과목 안내와 결재 전 점검에 쓴다",
   "properties": {
    "basis": {"type": "string", "description": "기준 문서(예: 2026 자체예산집행지침)"},
    "items": {"type": "array", "items": {"type": "object", "required": ["name"],
              "properties": {"code": {"type": "string"}, "name": {"type": "string"},
                             "procs": {"type": "array", "items": {"type": "string"}, "description": "이 과목을 흔히 쓰는 절차 id"},
                             "includes": {"type": "string", "description": "넣는 것"},
                             "excludes": {"type": "string", "description": "넣지 않는 것(헷갈리는 과목)"},
                             "note": {"type": "string", "description": "금액 기준 등 덧붙임"}}}}
   }
  },
  "updated": {
   "type": "string"
  },
  "updated_by": {
   "type": "string"
  }
 }
}
